<?xml version="1.0" encoding="UTF-8"?>
<!--Sample XML file generated by XMLSpy v2011 sp1 (http://www.altova.com)-->
<albumesFotos xsi:noNamespaceSchemaLocation="fotos.xsd" xmlns:xsi="http://www.w3.org/2001/XMLSchema-instance">
	<albumFotos>
		<titulo>String</titulo>
		<autor>
			<nombre>String1</nombre>
			<apellidos>String</apellidos>
			<apellidos>String</apellidos>
			<telefono>String</telefono>
			<telefono>String</telefono>
			<email>text</email>
		</autor>
		<foto id="ID_1">
			<nombre>String</nombre>
			<titulo>String</titulo>
			<fechaCaptura>1967-08-13</fechaCaptura>
			<horaCaptura>14:20:00.0Z</horaCaptura>
			<camara>String</camara>
			<ISO>800</ISO>
			<tiempoExposicion>0.125</tiempoExposicion>
			<datos>String</datos>
			<favorito>true</favorito>
		</foto>
		<foto id="ID_2">
			<nombre>String</nombre>
			<titulo>String</titulo>
			<fechaCaptura>1967-08-13</fechaCaptura>
			<horaCaptura>14:20:00.0Z</horaCaptura>
			<camara>String</camara>
			<ISO>800</ISO>
			<tiempoExposicion>0.125</tiempoExposicion>
			<datos>String</datos>
			<favorito>true</favorito>
		</foto>
		<foto id="ID_3">
			<nombre>String</nombre>
			<titulo>String</titulo>
			<fechaCaptura>1967-08-13</fechaCaptura>
			<horaCaptura>14:20:00.0Z</horaCaptura>
			<camara>String</camara>
			<ISO>800</ISO>
			<tiempoExposicion>0.125</tiempoExposicion>
			<datos>String</datos>
			<favorito>true</favorito>
		</foto>
	</albumFotos>
	<albumFotos>
		<titulo>String</titulo>
		<autor>
			<nombre>String</nombre>
			<apellidos>String</apellidos>
			<apellidos>String</apellidos>
			<telefono>String</telefono>
			<telefono>String</telefono>
			<email>text</email>
		</autor>
		<foto id="ID_4">
			<nombre>String</nombre>
			<titulo>String</titulo>
			<fechaCaptura>1967-08-13</fechaCaptura>
			<horaCaptura>14:20:00.0Z</horaCaptura>
			<camara>String</camara>
			<ISO>200</ISO>
			<tiempoExposicion>0.125</tiempoExposicion>
			<datos>String</datos>
			<favorito>true</favorito>
		</foto>
		<foto id="ID_5">
			<nombre>String</nombre>
			<titulo>String</titulo>
			<fechaCaptura>1967-08-13</fechaCaptura>
			<horaCaptura>14:20:00.0Z</horaCaptura>
			<camara>String</camara>
			<ISO>400</ISO>
			<tiempoExposicion>0.125</tiempoExposicion>
			<datos>String</datos>
			<favorito>true</favorito>
		</foto>
		<foto id="ID_6">
			<nombre>String</nombre>
			<titulo>String</titulo>
			<fechaCaptura>1967-08-13</fechaCaptura>
			<horaCaptura>14:20:00.0Z</horaCaptura>
			<camara>String</camara>
			<ISO>800</ISO>
			<tiempoExposicion>0.125</tiempoExposicion>
			<datos>String</datos>
			<favorito>true</favorito>
		</foto>
	</albumFotos>
	<albumFotos>
		<titulo>String</titulo>
		<autor>
			<nombre>String</nombre>
			<apellidos>String</apellidos>
			<apellidos>String</apellidos>
			<telefono>String</telefono>
			<telefono>String</telefono>
			<email>text</email>
		</autor>
		<foto id="ID_7">
			<nombre>String</nombre>
			<titulo>String</titulo>
			<fechaCaptura>1967-08-13</fechaCaptura>
			<horaCaptura>14:20:00.0Z</horaCaptura>
			<camara>String</camara>
			<ISO>400</ISO>
			<tiempoExposicion>0.125</tiempoExposicion>
			<datos>String</datos>
			<favorito>true</favorito>
		</foto>
		<foto id="ID_8">
			<nombre>String</nombre>
			<titulo>String</titulo>
			<fechaCaptura>1967-08-13</fechaCaptura>
			<horaCaptura>14:20:00.0Z</horaCaptura>
			<camara>String</camara>
			<ISO>400</ISO>
			<tiempoExposicion>0.125</tiempoExposicion>
			<datos>String</datos>
			<favorito>true</favorito>
		</foto>
		<foto id="ID_9">
			<nombre>String</nombre>
			<titulo>String</titulo>
			<fechaCaptura>1967-08-13</fechaCaptura>
			<horaCaptura>14:20:00.0Z</horaCaptura>
			<camara>String</camara>
			<ISO>400</ISO>
			<tiempoExposicion>0.125</tiempoExposicion>
			<datos>String</datos>
			<favorito>true</favorito>
		</foto>
	</albumFotos>
</albumesFotos>
